2024-07-09 14:34:20.329245: E external/local_xla/xla/stream_executor/cuda/cuda_fft.cc:479] Unable to register cuFFT factory: Attempting to register factory for plugin cuFFT when one has already been registered
2024-07-09 14:34:20.349920: E external/local_xla/xla/stream_executor/cuda/cuda_dnn.cc:10575] Unable to register cuDNN factory: Attempting to register factory for plugin cuDNN when one has already been registered
2024-07-09 14:34:20.349954: E external/local_xla/xla/stream_executor/cuda/cuda_blas.cc:1442] Unable to register cuBLAS factory: Attempting to register factory for plugin cuBLAS when one has already been registered
2024-07-09 14:34:20.362602: I tensorflow/core/platform/cpu_feature_guard.cc:210] This TensorFlow binary is optimized to use available CPU instructions in performance-critical operations.
To enable the following instructions: AVX2 FMA, in other operations, rebuild TensorFlow with the appropriate compiler flags.
2024-07-09 14:34:21.012203: W tensorflow/compiler/tf2tensorrt/utils/py_utils.cc:38] TF-TRT Warning: Could not find TensorRT
INFO: A new study created in memory with name: no-name-85ec1c71-cf25-4a49-9075-2e326703ee28
/opt/venv/lib/python3.10/site-packages/torch/cuda/__init__.py:619: UserWarning: Can't initialize NVML
/opt/venv/lib/python3.10/site-packages/stable_baselines3/common/evaluation.py:67: UserWarning: Evaluation environment is not wrapped with a ``Monitor`` wrapper. This may result in reporting modified episode lengths and rewards, if other wrappers happen to modify these. Consider wrapping environment first with ``Monitor`` wrapper.
INFO: Trial 0 finished with value: -1962.785800933838 and parameters: {'batch_size': 32, 'n_steps': 512, 'gamma': 0.999, 'learning_rate': 7.524638531830896e-05, 'ent_coef': 6.1139054679777365e-06, 'clip_range': 0.1, 'n_epochs': 1, 'gae_lambda': 0.99, 'max_grad_norm': 1, 'vf_coef': 0.6533124303213419, 'net_arch': 'medium', 'activation_fn': 'tanh'}. Best is trial 0 with value: -1962.785800933838.
INFO: Trial 1 finished with value: -3311.3423473358152 and parameters: {'batch_size': 32, 'n_steps': 8, 'gamma': 0.999, 'learning_rate': 0.00018646235087846412, 'ent_coef': 0.07104811036029922, 'clip_range': 0.4, 'n_epochs': 20, 'gae_lambda': 1.0, 'max_grad_norm': 0.5, 'vf_coef': 0.4000160858698619, 'net_arch': 'small', 'activation_fn': 'tanh'}. Best is trial 0 with value: -1962.785800933838.
INFO: Trial 2 finished with value: -5158.659586334228 and parameters: {'batch_size': 64, 'n_steps': 8, 'gamma': 0.995, 'learning_rate': 1.5151795502564112e-05, 'ent_coef': 0.0036681751796986844, 'clip_range': 0.3, 'n_epochs': 20, 'gae_lambda': 0.95, 'max_grad_norm': 2, 'vf_coef': 0.8113209369622987, 'net_arch': 'tiny', 'activation_fn': 'relu'}. Best is trial 0 with value: -1962.785800933838.
INFO: Trial 3 finished with value: -5428.073636627198 and parameters: {'batch_size': 512, 'n_steps': 128, 'gamma': 0.95, 'learning_rate': 0.0007167782436561065, 'ent_coef': 0.004959437953274595, 'clip_range': 0.2, 'n_epochs': 5, 'gae_lambda': 0.9, 'max_grad_norm': 5, 'vf_coef': 0.35721502732802257, 'net_arch': 'tiny', 'activation_fn': 'relu'}. Best is trial 0 with value: -1962.785800933838.
INFO: Trial 4 finished with value: -5436.6755306243895 and parameters: {'batch_size': 32, 'n_steps': 2048, 'gamma': 0.98, 'learning_rate': 0.0010530315022038127, 'ent_coef': 4.0160900411518516e-08, 'clip_range': 0.4, 'n_epochs': 10, 'gae_lambda': 1.0, 'max_grad_norm': 2, 'vf_coef': 0.09373085026904515, 'net_arch': 'small', 'activation_fn': 'tanh'}. Best is trial 0 with value: -1962.785800933838.
/opt/venv/lib/python3.10/site-packages/stable_baselines3/common/save_util.py:284: UserWarning: Path 'rl4greencrab/notebooks/study_results' does not exist. Will create it.
INFO: Trial 5 finished with value: -454.57524847984314 and parameters: {'batch_size': 16, 'n_steps': 512, 'gamma': 0.999, 'learning_rate': 0.038948823372368754, 'ent_coef': 1.882075784082098e-06, 'clip_range': 0.1, 'n_epochs': 1, 'gae_lambda': 0.99, 'max_grad_norm': 1, 'vf_coef': 0.9340079833998552, 'net_arch': 'medium', 'activation_fn': 'tanh'}. Best is trial 5 with value: -454.57524847984314.
/opt/venv/lib/python3.10/site-packages/stable_baselines3/common/evaluation.py:67: UserWarning: Evaluation environment is not wrapped with a ``Monitor`` wrapper. This may result in reporting modified episode lengths and rewards, if other wrappers happen to modify these. Consider wrapping environment first with ``Monitor`` wrapper.
INFO: Trial 6 finished with value: -454.4519449710846 and parameters: {'batch_size': 16, 'n_steps': 16, 'gamma': 0.9, 'learning_rate': 0.09468920199932987, 'ent_coef': 9.514222472635832e-07, 'clip_range': 0.1, 'n_epochs': 1, 'gae_lambda': 0.99, 'max_grad_norm': 1, 'vf_coef': 0.9890753630579475, 'net_arch': 'medium', 'activation_fn': 'tanh'}. Best is trial 6 with value: -454.4519449710846.
INFO: Trial 7 finished with value: -252.8999841308687 and parameters: {'batch_size': 16, 'n_steps': 16, 'gamma': 0.9, 'learning_rate': 0.08384983206194686, 'ent_coef': 1.9989029025435966e-08, 'clip_range': 0.1, 'n_epochs': 1, 'gae_lambda': 0.98, 'max_grad_norm': 0.7, 'vf_coef': 0.9947553093336602, 'net_arch': 'medium', 'activation_fn': 'tanh'}. Best is trial 7 with value: -252.8999841308687.
